<?xml version="1.0" encoding="UTF-8"?>
<systemTransformations
	xmlns:xsi="http://www.w3.org/2001/XMLSchema-instance"
	xsi:noNamespaceSchemaLocation="../systemTransformations.xsd">
	<systemTransformation
		name="ELEMENT-TURN-WITHOUT-LOAD">
		<systemTemplate>
			<objectTemplates>
				<objectTemplate id="ID-ROBOT">
					<attributeTemplates>
						<attributeTemplate name="ATTRIBUTE-PICK-AND-PLACE-ROBOT" value="true" />
					</attributeTemplates>
					<linkTemplates>
						<linkTemplate name="LINK-ROTARY-DRIVE-POSITION" value="ID-PLANE-Y-SOURCE" />
						<linkTemplate name="LINK-GRAB-POSITION" value="null" />
					</linkTemplates>
				</objectTemplate>
				<objectTemplate id="ID-PLANE-Y-TARGET">
					<attributeTemplates>
						<attributeTemplate name="ATTRIBUTE-PLANE-Y" value="true" />
					</attributeTemplates>
					<linkTemplates>
						<linkTemplate name="LINK-ROTARY-DRIVE-POSITION" value="ID-ROBOT" />
					</linkTemplates>
				</objectTemplate>
				<objectTemplate id="ID-PLANE-Y-SOURCE">
					<attributeTemplates>
						<attributeTemplate name="ATTRIBUTE-PLANE-Y" value="true" />
					</attributeTemplates>
					<linkTemplates>
						<linkTemplate name="LINK-ROTARY-DRIVE-POSITION" value="null" />
					</linkTemplates>
				</objectTemplate>
			</objectTemplates>
		</systemTemplate>
		<transformations>
			<transformation type="link" objectId="ID-ROBOT" linkName="LINK-ROTARY-DRIVE-POSITION" linkOldValue="ID-PLANE-Y-SOURCE" linkNewValue="ID-PLANE-Y-TARGET" />
			<transformation type="link" objectId="ID-PLANE-Y-TARGET" linkName="LINK-ROTARY-DRIVE-POSITION" linkOldValue="null" linkNewValue="ID-ROBOT" />
			<transformation type="link" objectId="ID-PLANE-Y-SOURCE" linkName="LINK-ROTARY-DRIVE-POSITION" linkOldValue="ID-ROBOT" linkNewValue="null" />
		</transformations>
		<action name="OPERATION-TURN-WITHOUT-LOAD">
			<parameterUpdaters>
				<parameterUpdater>
					<script type="lua">
						<line n="1">local systemVariant = ...</line>
						<line n="2">local object = systemVariant:getObjectByIdMatch('ID-PLANE-Y-TARGET')</line>
						<line n="3">systemVariant:setActionParameter('PARAMETER_TARGET',object:getName())</line>
					</script>
				</parameterUpdater>
			</parameterUpdaters>
		</action>
	</systemTransformation>
</systemTransformations>